{"$schema":"https://json-schema.org/draft/2020-12/schema","type":"object","required":["record_id","faculty","program","curriculum_version","component","workload","extension_hours","extracurricular_hours","evidence_ref","completion_state","hash","supersedes"],"properties":{"record_id":{"type":"string"},"faculty":{"type":"string"},"program":{"type":"string"},"curriculum_version":{"type":"string"},"component":{"type":"string"},"workload":{"type":"object"},"extension_hours":{"type":"number","minimum":0},"extracurricular_hours":{"type":"number","minimum":0},"evidence_ref":{"type":"array"},"completion_state":{"type":"string"},"hash":{"type":"object"},"supersedes":{"type":["string","null"]}}}
